{
    "version": "2.4.7-I607-Win10-5",
    "description": "A free and open-source software application that implements virtual private network (VPN) techniques.",
    "homepage": "https://openvpn.net",
    "license": {
        "identifier": "GPL-2.0-only",
        "url": "https://openvpn.net/terms/"
    },
    "persist": [
        "data",
        "openvpn-portable.yml"
    ],
    "architecture": {
        "64bit": {
            "url": "https://github.com/portapps/openvpn-portable/releases/download/2.4.7-I607-Win10-5/openvpn-portable-win64-2.4.7-I607-Win10-5.7z#/dl.7z",
            "hash": "5fa00c5fec5b2d0097e66987c0133788a1e603c46a6f02b326997e120b28c4d3"
        },
        "32bit": {
            "url": "https://github.com/portapps/openvpn-portable/releases/download/2.4.7-I607-Win10-5/openvpn-portable-win32-2.4.7-I607-Win10-5.7z#/dl.7z",
            "hash": "4fff6bbe168b4e2581f960a3eeb869d6ebb04a5be7500f3fa15dd41f1cf8bbdb"
        }
    },
    "shortcuts": [
        [
            "openvpn-portable.exe",
            "OpenVPN"
        ]
    ],
    "pre_install": "if(!(Test-Path \"$persist_dir\\openvpn-portable.yml\")) { New-Item \"$dir\\openvpn-portable.yml\" | Out-Null }",
    "checkver": {
        "url": "https://github.com/portapps/openvpn-portable/releases",
        "regex": "\\/releases\\/tag\\/(?:v|V)?([I\\d.-]+Win10-[\\d]+)"
    },
    "autoupdate": {
        "architecture": {
            "64bit": {
                "url": "https://github.com/portapps/openvpn-portable/releases/download/$version/openvpn-portable-win64-$version.7z#/dl.7z"
            },
            "32bit": {
                "url": "https://github.com/portapps/openvpn-portable/releases/download/$version/openvpn-portable-win32-$version.7z#/dl.7z"
            }
        },
        "hash": {
            "url": "$baseurl/checksums.txt"
        }
    },
    "notes": "Installed from Portapps (https://portapps.io/app/openvpn-portable/)"
}
