{
    "version": "1.17.8",
    "description": "Install and run Python applications in isolated environments",
    "homepage": "https://pipx.pypa.io/",
    "license": "MIT",
    "suggest": {
        "Python": "python"
    },
    "pre_install": "Set-Content -Value '@python \"%~dp0pipx.pyz\" %*' -Path \"$dir\\pipx.bat\"",
    "url": "https://github.com/pypa/pipx/releases/download/1.17.8/pipx.pyz",
    "hash": "a5827798e78767c7f83c7261400e3521a68c18cae9f6635ad7fe739290cb3e87",
    "bin": "pipx.bat",
    "env_add_path": "data\\bin",
    "env_set": {
        "PIPX_HOME": "$dir\\data",
        "PIPX_BIN_DIR": "$dir\\data\\bin",
        "PIPX_MAN_DIR": "$dir\\data\\share\\man"
    },
    "persist": "data",
    "checkver": {
        "github": "https://github.com/pypa/pipx"
    },
    "autoupdate": {
        "url": "https://github.com/pypa/pipx/releases/download/$version/pipx.pyz"
    }
}
