{
    "version": "436115635",
    "description": "DockerGS is a container that run Grasscutter (anime game) with just a single command.",
    "homepage": "https://github.com/akbaryahya/DockerGS",
    "license": "AGPL-3.0",
    "depends": [
        "temurin17-jdk",
        "yuukips-resource"
    ],
    "url": "https://nightly.link/akbaryahya/DockerGS/actions/artifacts/436115635.zip",
    "hash": "6aa8bdff0ae7c4f7c6b7ad2aa3e500d059cad66479814f96a5707dec48bb5aba",
    "pre_install": [
        "if (!(Test-Path \"$persist_dir\\config.json\"))",
        "{",
        "    Copy-Item \"$bucketsdir\\custom\\scripts\\yuukips\\config.json\" \"$dir\"",
        "}",
        "Set-Content \"$dir\\dockergs.bat\" 'java -jar \"%~dp0grasscutter.jar\" %1' -Encoding Ascii"
    ],
    "bin": "dockergs.bat",
    "persist": [
        "cache",
        "data",
        "logs",
        "plugins",
        "config.json"
    ],
    "post_install": [
        "$config = Get-Content \"$dir\\config.json\" | ConvertFrom-Json",
        "$config.folderStructure.resources = \"$(appdir yuukips-resource)\\current\\resources.zip\"",
        "$config | ConvertTo-Json -Depth 10 | Set-Content \"$dir\\config.json\""
    ],
    "checkver": {
        "url": "https://nightly.link/akbaryahya/DockerGS/workflows/DockerGS_GC_Alpine_3.2/main/DockerGS-GC",
        "regex": "(\\d+).zip"
    },
    "autoupdate": {
        "url": "https://nightly.link/akbaryahya/DockerGS/actions/artifacts/$version.zip"
    }
}
