{
    "version": "1.11.3.332",
    "description": "A frontend for legendary, the open source Epic Games Launcher alternative.",
    "homepage": "https://github.com/Dummerle/Rare",
    "license": "GPL-3.0-only",
    "architecture": {
        "64bit": {
            "url": "https://github.com/Dummerle/Rare/releases/download/1.11.3.332/Rare-1.11.3.332.msi",
            "hash": "c5b1727b9a01818bb22704bf993fe744f2e8a9025e39406e8febd340f118e28b"
        }
    },
    "bin": "Rare.exe",
    "shortcuts": [
        [
            "Rare.exe",
            "Rare"
        ]
    ],
    "checkver": "github",
    "autoupdate": {
        "architecture": {
            "64bit": {
                "url": "https://github.com/Dummerle/Rare/releases/download/$version/Rare-$version.msi"
            }
        }
    }
}
