{
    "version": "2.4.2379",
    "description": "A manga reader compatible with Tachiyomi extensions and backups",
    "homepage": "https://github.com/Suwayomi/Suwayomi-Server-preview",
    "license": {
        "identifier": "MPL-2.0",
        "url": "https://github.com/Suwayomi/Suwayomi-Server/blob/master/LICENSE"
    },
    "architecture": {
        "64bit": {
            "url": [
                "https://github.com/Suwayomi/Suwayomi-Server-preview/releases/download/v2.4.2379/Suwayomi-Server-v2.4.2379-windows-x64.zip",
                "https://raw.githubusercontent.com/Suwayomi/Suwayomi-Server/master/server/src/main/resources/icon/faviconlogo.ico",
                "https://github.com/ScoopInstaller/Extras/raw/master/scripts/suwayomi-server/suwayomi.ps1#/suwayomi-server-launcher.ps1"
            ],
            "hash": [
                "c5dc07727815810f6f577dbf1f7f3d3382e23c780f5c2180cdffdd88fabe92ae",
                "3e5b32450bc8659f41b5da5b85a246d8e500ea5b93c917abb8032e6f80068550",
                "f7d32050ace8bcb05005a65da1dae174e3eeca86a370e769639f5c0d03e61629"
            ],
            "extract_dir": "Suwayomi-Server-v2.4.2379-windows-x64"
        }
    },
    "pre_install": "Set-Content \"$dir\\suwayomi-server.ps1\" -Value \"& $dir\\jre\\bin\\java `\"-Dsuwayomi.tachidesk.config.server.rootDir=$dir\\data`\" -jar $dir\\bin\\Suwayomi-Server.jar\" -Encoding Ascii",
    "post_install": [
        "if (Test-Path $env:LOCALAPPDATA\\Tachidesk) {",
        "    Copy-Item -Path $env:LOCALAPPDATA\\Tachidesk\\* -Destination \"$persist_dir\\data\" -Force -Recurse",
        "    Remove-Item $env:LOCALAPPDATA\\Tachidesk -Force -Recurse",
        "}"
    ],
    "bin": [
        [
            "suwayomi-server-launcher.ps1",
            "suwayomi-server-preview-launcher"
        ],
        [
            "suwayomi-server.ps1",
            "suwayomi-server-preview"
        ]
    ],
    "shortcuts": [
        [
            "Suwayomi Launcher.bat",
            "Suwayomi Server Preview Launcher",
            "",
            "faviconlogo.ico"
        ],
        [
            "suwayomi-server.ps1",
            "Suwayomi Server Preview",
            "",
            "faviconlogo.ico"
        ]
    ],
    "persist": "data",
    "checkver": "github",
    "autoupdate": {
        "architecture": {
            "64bit": {
                "url": "https://github.com/Suwayomi/Suwayomi-Server-preview/releases/download/v$version/Suwayomi-Server-v$version-windows-x64.zip",
                "extract_dir": "Suwayomi-Server-v$version-windows-x64"
            }
        }
    }
}
