{
    "version": "1.76.20-9",
    "description": "An open source, tabbed, multi-protocol, remote connections manager.",
    "homepage": "https://mremoteng.org/",
    "license": {
        "identifier": "GPL-2.0-only",
        "url": "https://github.com/mRemoteNG/mRemoteNG/blob/develop/COPYING.TXT"
    },
    "url": "https://github.com/portapps/mremoteng-portable/releases/download/1.76.20-9/mremoteng-portable-win32-1.76.20-9.7z#/dl.7z",
    "hash": "cf348b533e45995b2c339feb47303681896a3816d449e1104ada0e8c8b28a111",
    "persist": [
        "data",
        "mremoteng-portable.yml"
    ],
    "shortcuts": [
        [
            "mremoteng-portable.exe",
            "mRemoteNG"
        ]
    ],
    "pre_install": "if(!(Test-Path \"$persist_dir\\mremoteng-portable.yml\")) { New-Item \"$dir\\mremoteng-portable.yml\" | Out-Null }",
    "checkver": {
        "url": "https://github.com/portapps/mremoteng-portable/releases",
        "regex": "\\/releases\\/tag\\/(?:v|V)?([\\d.-]+)"
    },
    "autoupdate": {
        "url": "https://github.com/portapps/mremoteng-portable/releases/download/$version/mremoteng-portable-win32-$version.7z#/dl.7z",
        "hash": {
            "url": "$baseurl/checksums.txt"
        }
    },
    "notes": "Installed from Portapps (https://portapps.io/app/mremoteng-portable/)"
}
