{
    "homepage": "https://www.microsoft.com/en-us/edge",
    "description": "The chromium based Microsoft Edge browser",
    "version": "115.0.1901.203",
    "license": "Freeware",
    "architecture": {
        "64bit": {
            "url": "https://dorado-api.deno.dev/edge?arch=64&channel=stable&version=115.0.1901.203&dl#/MicrosoftEdge-115.0.1901.203-x64.7z",
            "hash": "52695a998c0aabd5ef2e39b05ec27073a44a3e0efc65eed1bd252f92e9f2c0e1"
        },
        "32bit": {
            "url": "https://dorado-api.deno.dev/edge?arch=86&channel=stable&version=115.0.1901.203&dl#/MicrosoftEdge-115.0.1901.203-x86.7z",
            "hash": "a9a0a69336c7d7e8e591d58567d32859dedbd9172042a9d574c580d0188e9283"
        },
        "arm64": {
            "url": "https://dorado-api.deno.dev/edge?arch=arm64&channel=stable&version=115.0.1901.203&dl#/MicrosoftEdge-115.0.1901.203-arm64.7z",
            "hash": "c948e6ff08e34e9ff70c77b97e9d3527d85823f025d638af02cf3cd3920f6a46"
        }
    },
    "installer": {
        "script": "Expand-7zipArchive -Path \"$dir\\MSEDGE.7z\" -ExtractDir \"Chrome-bin\\$version\" -Removal"
    },
    "shortcuts": [
        [
            "msedge.exe",
            "Microsoft Edge"
        ]
    ],
    "checkver": {
        "url": "https://dorado-api.deno.dev/edge?arch=64&channel=stable",
        "jsonpath": "$.Version"
    },
    "autoupdate": {
        "architecture": {
            "64bit": {
                "url": "https://dorado-api.deno.dev/edge?arch=64&channel=stable&version=$version&dl#/MicrosoftEdge-$version-x64.7z",
                "hash": {
                    "url": "https://dorado-api.deno.dev/edge?arch=64&channel=stable&version=$version",
                    "jsonpath": "$.Hashes.Sha256"
                }
            },
            "32bit": {
                "url": "https://dorado-api.deno.dev/edge?arch=86&channel=stable&version=$version&dl#/MicrosoftEdge-$version-x86.7z",
                "hash": {
                    "url": "https://dorado-api.deno.dev/edge?arch=86&channel=stable&version=$version",
                    "jsonpath": "$.Hashes.Sha256"
                }
            },
            "arm64": {
                "url": "https://dorado-api.deno.dev/edge?arch=arm64&channel=stable&version=$version&dl#/MicrosoftEdge-$version-arm64.7z",
                "hash": {
                    "url": "https://dorado-api.deno.dev/edge?arch=arm64&channel=stable&version=$version",
                    "jsonpath": "$.Hashes.Sha256"
                }
            }
        }
    }
}