{
    "version": "1.5.1-8",
    "description": "A tool for converting video from nearly any format to a selection of modern, widely supported codecs.",
    "homepage": "https://handbrake.fr/",
    "license": "https://github.com/HandBrake/HandBrake/blob/master/LICENSE",
    "persist": [
        "data",
        "handbrake-portable.yml"
    ],
    "architecture": {
        "64bit": {
            "url": "https://github.com/portapps/handbrake-portable/releases/download/1.5.1-8/handbrake-portable-win64-1.5.1-8.7z#/dl.7z",
            "hash": "5bb4934a723bfd37a69e4d70e994adc7a129bc593fa1ea750bd721df5401dcb5"
        }
    },
    "shortcuts": [
        [
            "handbrake-portable.exe",
            "Handbrake"
        ]
    ],
    "pre_install": "if(!(Test-Path \"$persist_dir\\handbrake-portable.yml\")) { New-Item \"$dir\\handbrake-portable.yml\" | Out-Null }",
    "checkver": {
        "url": "https://github.com/portapps/handbrake-portable/releases",
        "regex": "\\/releases\\/tag\\/(?:v|V)?([\\d.-]+)"
    },
    "autoupdate": {
        "architecture": {
            "64bit": {
                "url": "https://github.com/portapps/handbrake-portable/releases/download/$version/handbrake-portable-win64-$version.7z#/dl.7z"
            }
        },
        "hash": {
            "url": "$baseurl/checksums.txt"
        }
    },
    "notes": "Installed from Portapps (https://portapps.io/app/handbrake-portable/)"
}
