{
    "version": "14.09",
    "homepage": "https://docs.microsoft.com/en-us/sysinternals/downloads/autoruns",
    "description": "See what programs are configured to startup automatically when your system boots and you login.",
    "license": {
        "identifier": "Microsoft SysInternals EULA",
        "url": "https://docs.microsoft.com/en-us/sysinternals/license-terms"
    },
    "url": "https://download.sysinternals.com/files/Autoruns.zip",
    "hash": "f82294355e98051aed850e567c676466c16beca333e1fe96fe7cab003e987764",
    "architecture": {
        "64bit": {
            "shortcuts": [
                [
                    "Autoruns64.exe",
                    "Autoruns"
                ]
            ]
        },
        "32bit": {
            "shortcuts": [
                [
                    "Autoruns.exe",
                    "Autoruns"
                ]
            ]
        }
    },
    "checkver": {
        "re": "Autoruns for Windows v([\\d.]+)"
    },
    "autoupdate": {
        "url": "https://download.sysinternals.com/files/Autoruns.zip",
        "hash": {
            "url": "https://plunger-dotnet-api.herokuapp.com/autoruns",
            "jp": "$.sha256"
        }
    }
}
