{
    "version": "3.0.16-11",
    "description": "A free and open-source, portable, cross-platform media player and streaming media server.",
    "homepage": "https://www.videolan.org/vlc/",
    "license": {
        "identifier": "GPL-2.0-only",
        "url": "https://www.videolan.org/legal.html"
    },
    "persist": [
        "data",
        "vlc-portable.yml"
    ],
    "architecture": {
        "64bit": {
            "url": "https://github.com/portapps/vlc-portable/releases/download/3.0.16-11/vlc-portable-win64-3.0.16-11.7z#/dl.7z",
            "hash": "8a904be312fe68dd8b2205765564dc1e2b32fc7456a9b6f37b292a1e5ca397c3"
        }
    },
    "shortcuts": [
        [
            "vlc-portable.exe",
            "VLC"
        ]
    ],
    "pre_install": "if(!(Test-Path \"$persist_dir\\vlc-portable.yml\")) { New-Item \"$dir\\vlc-portable.yml\" | Out-Null }",
    "checkver": {
        "url": "https://github.com/portapps/vlc-portable/releases",
        "regex": "\\/releases\\/tag\\/(?:v|V)?([\\d.-]+)"
    },
    "autoupdate": {
        "architecture": {
            "64bit": {
                "url": "https://github.com/portapps/vlc-portable/releases/download/$version/vlc-portable-win64-$version.7z#/dl.7z"
            }
        },
        "hash": {
            "url": "$baseurl/checksums.txt"
        }
    },
    "notes": "Installed from Portapps (https://portapps.io/app/vlc-portable/)"
}
