{
    "version": "3.2.6",
    "description": "A custom client designed to enhance your Discord experience while keeping everything lightweight.",
    "homepage": "https://github.com/ArmCord/ArmCord",
    "license": "OSL-3.0",
    "architecture": {
        "64bit": {
            "url": "https://github.com/ArmCord/ArmCord/releases/download/v3.2.6/ArmCord.Setup.3.2.6.exe#/dl.7z",
            "hash": "7dab16efb7de5a692da6e2d0a900cea2d68e3a7828c5f1ad27cd180f24acb82e",
            "pre_install": [
                "Expand-7zipArchive \"$dir\\`$PLUGINSDIR\\app-64.7z\" \"$dir\"",
                "Remove-Item \"$dir\\`$*\", \"$dir\\Uninst*\" -Recurse"
            ]
        }
    },
    "pre_uninstall": "Stop-Process -Name 'ArmCord' -ErrorAction SilentlyContinue",
    "bin": "ArmCord.exe",
    "shortcuts": [
        [
            "ArmCord.exe",
            "ArmCord",
            "--user-data-dir=\"$dir\\data\""
        ]
    ],
    "persist": "data",
    "checkver": "github",
    "autoupdate": {
        "architecture": {
            "64bit": {
                "url": "https://github.com/ArmCord/ArmCord/releases/download/v$version/ArmCord.Setup.$version.exe#/dl.7z"
            }
        }
    },
    "##": [
        "\"hash\": {",
        "    \"url\": \"$baseurl/latest.yml\"",
        "    \"regex\": \"sha512:\\s$base64\"",
        "}"
    ]
}
