{
    "version": "1.8.23",
    "description": "cd command replacement",
    "homepage": "https://github.com/skywind3000/z.lua",
    "license": "MIT",
    "notes": "Configure accordingly to 'https://github.com/skywind3000/z.lua#install'",
    "depends": "lua",
    "url": "https://github.com/skywind3000/z.lua/archive/1.8.23.zip",
    "hash": "f4328806e6e87fb05cf1266cd8c03f169124b68fa792e46529f565db130368a6",
    "extract_dir": "z.lua-1.8.23",
    "bin": "z.cmd",
    "checkver": "github",
    "autoupdate": {
        "url": "https://github.com/skywind3000/z.lua/archive/$version.zip",
        "extract_dir": "z.lua-$version"
    }
}
