{
    "version": "0.40.5",
    "description": "Open Source backend for your next SaaS and Mobile app in 1 file",
    "homepage": "https://pocketbase.io/",
    "license": "MIT",
    "url": "https://github.com/pocketbase/pocketbase/releases/download/v0.40.5/pocketbase_0.40.5_windows_amd64.zip",
    "hash": "d0980d1f3a8097ff4c03a876e8c98f3008a83c0d42cc03b636bc92b2d4788d1c",
    "bin": "pocketbase.exe",
    "persist": "pb_data",
    "checkver": {
        "github": "https://github.com/pocketbase/pocketbase"
    },
    "autoupdate": {
        "url": "https://github.com/pocketbase/pocketbase/releases/download/v$version/pocketbase_$version_windows_amd64.zip",
        "hash": {
            "url": "https://github.com/pocketbase/pocketbase/releases/download/v$version/checksums.txt"
        },
        "extract_dir": "pocketbase_$version_windows_amd64"
    }
}
