{
    "version": "6.13.2",
    "description": "Tiny alternative Discord client with a smaller footprint, themes and plugins, multi-profile, and more!",
    "homepage": "https://github.com/SpikeHD/Dorion",
    "license": {
        "identifier": "GPL-3.0",
        "url": "https://github.com/SpikeHD/Dorion/blob/main/LICENSE"
    },
    "architecture": {
        "64bit": {
            "url": "https://github.com/SpikeHD/Dorion/releases/download/v6.13.2/Dorion_6.13.2_win64_portable.zip",
            "hash": "65a8c72a0fb32ec3aa50a73f91451b3b2ea30c801cd6ad0bb14f5e4913e11b8e"
        },
        "arm64": {
            "url": "https://github.com/SpikeHD/Dorion/releases/download/v6.13.2/Dorion_6.13.2_win_arm64_portable.zip",
            "hash": "486228334d629b61f60a247dac01c43014a26b59c0b1aef41165d0ddce6de019"
        }
    },
    "pre_install": [
        "$files = @('config.json', 'detectables.json')",
        "if (-not (Test-Path -Path $persist_dir)) {",
        "    New-Item -Path $persist_dir -ItemType Directory",
        "}",
        "foreach ($file in $files) {",
        "    if (-not (Test-Path -Path (Join-Path $persist_dir $file))) {",
        "        New-Item -Path (Join-Path $persist_dir $file)",
        "    }",
        "}"
    ],
    "post_install": [
        "$sourceFolders = @(\"~\\dorion\", \"$env:APPDATA\\dorion\")",
        "$canMoveFolders = $false",
        "foreach ($sourceFolder in $sourceFolders) {",
        "    If (Test-Path -Path \"$sourceFolder\\*\") {$canMoveFolders = $true; break}",
        "}",
        "If ($canMoveFolders) {",
        "    $confirm = Read-Host -Prompt \"Do you want to move the current data to '$persist_dir'? (Y/N)\"",
        "    If ($confirm.ToUpper() -eq \"Y\") {",
        "        foreach ($sourceFolder in $sourceFolders) {",
        "            If (Test-Path -Path \"$sourceFolder\") {",
        "                If (Test-Path -Path \"$sourceFolder\") {Move-Item -Path \"$sourceFolder\\*\" -Destination \"$persist_dir\" -Force}",
        "                Remove-Item \"$sourceFolder\" -Force -Recurse",
        "            }",
        "        }",
        "    }",
        "}",
        "Remove-Item \"$dir\\*.original\" -Force -Recurse"
    ],
    "shortcuts": [
        [
            "Dorion.exe",
            "Dorion"
        ]
    ],
    "persist": [
        "config.json",
        "detectables.json",
        "plugins",
        "logs",
        "themes",
        "profiles",
        "extensions"
    ],
    "checkver": "github",
    "autoupdate": {
        "extract_dir": "Dorion_$version_win64_portable",
        "architecture": {
            "64bit": {
                "url": "https://github.com/SpikeHD/Dorion/releases/download/v$version/Dorion_$version_win64_portable.zip"
            },
            "arm64": {
                "url": "https://github.com/SpikeHD/Dorion/releases/download/v$version/Dorion_$version_win_arm64_portable.zip"
            }
        }
    }
}
